[
  {
    "id": "research-001",
    "profile": "unattributed-secondary",
    "input": {
      "yearCanChi": "giap-ty",
      "lunarMonth": 1,
      "lunarMonthBranch": "dan",
      "lunarDay": 12,
      "birthHourBranch": "ngo",
      "gender": "male",
      "elementPhase": 2
    },
    "observations": {
      "taiSuiGeneral": {
        "value": "Kim Biện Đại Tướng Quân",
        "status": "observed",
        "sourceRefs": [
          "src-01"
        ]
      },
      "mingGongPosition": {
        "value": 9,
        "branch": "Thân (9)",
        "status": "derived",
        "sourceRefs": [
          "src-11"
        ]
      },
      "shenGongPosition": {
        "value": 3,
        "branch": "Dần (3)",
        "status": "derived",
        "sourceRefs": [
          "src-11"
        ]
      },
      "ziWeiPositionRule1": {
        "value": null,
        "status": "unresolved_due_to_missing_source_data"
      },
      "ziWeiPositionRule2": {
        "value": 6,
        "branch": "Tị (6)",
        "status": "conflict-candidate",
        "sourceRefs": [
          "src-11"
        ]
      },
      "cuc": {
        "value": null,
        "status": "unresolved_due_to_missing_source_data"
      }
    }
  },
  {
    "id": "research-002",
    "profile": "unattributed-secondary",
    "input": {
      "yearCanChi": "at-suu",
      "lunarMonth": 2,
      "lunarMonthBranch": "mao",
      "lunarDay": 17,
      "birthHourBranch": "ty",
      "gender": "female",
      "elementPhase": 5
    },
    "observations": {
      "taiSuiGeneral": {
        "value": "Trần Lâm Đại Tướng Quân",
        "status": "observed",
        "sourceRefs": [
          "src-01"
        ]
      },
      "mingGongPosition": {
        "value": 4,
        "branch": "Mão (4)",
        "status": "derived",
        "sourceRefs": [
          "src-11"
        ]
      },
      "shenGongPosition": {
        "value": 4,
        "branch": "Mão (4)",
        "status": "derived",
        "sourceRefs": [
          "src-11"
        ]
      },
      "ziWeiPositionRule1": {
        "value": null,
        "status": "unresolved_due_to_missing_source_data"
      },
      "ziWeiPositionRule2": {
        "value": 1,
        "branch": "Tý (1)",
        "status": "conflict-candidate",
        "sourceRefs": [
          "src-11"
        ]
      },
      "cuc": {
        "value": null,
        "status": "unresolved_due_to_missing_source_data"
      }
    }
  },
  {
    "id": "research-003",
    "profile": "unattributed-secondary",
    "input": {
      "yearCanChi": "binh-dan",
      "lunarMonth": 3,
      "lunarMonthBranch": "thin",
      "lunarDay": 22,
      "birthHourBranch": "suu",
      "gender": "male",
      "elementPhase": 6
    },
    "observations": {
      "taiSuiGeneral": {
        "value": "Cảnh Chương Đại Tướng Quân",
        "status": "observed",
        "sourceRefs": [
          "src-01"
        ]
      },
      "mingGongPosition": {
        "value": 4,
        "branch": "Mão (4)",
        "status": "derived",
        "sourceRefs": [
          "src-11"
        ]
      },
      "shenGongPosition": {
        "value": 5,
        "branch": "Thìn (5)",
        "status": "derived",
        "sourceRefs": [
          "src-11"
        ]
      },
      "ziWeiPositionRule1": {
        "value": null,
        "status": "unresolved_due_to_missing_source_data"
      },
      "ziWeiPositionRule2": {
        "value": 6,
        "branch": "Tị (6)",
        "status": "conflict-candidate",
        "sourceRefs": [
          "src-11"
        ]
      },
      "cuc": {
        "value": null,
        "status": "unresolved_due_to_missing_source_data"
      }
    }
  },
  {
    "id": "research-004",
    "profile": "unattributed-secondary",
    "input": {
      "yearCanChi": "dinh-mao",
      "lunarMonth": 4,
      "lunarMonthBranch": "ti",
      "lunarDay": 1,
      "birthHourBranch": "than",
      "gender": "female",
      "elementPhase": 3
    },
    "observations": {
      "taiSuiGeneral": {
        "value": "Trầm Hưng Đại Tướng Quân",
        "status": "observed",
        "sourceRefs": [
          "src-01"
        ]
      },
      "mingGongPosition": {
        "value": 10,
        "branch": "Dậu (10)",
        "status": "derived",
        "sourceRefs": [
          "src-11"
        ]
      },
      "shenGongPosition": {
        "value": 6,
        "branch": "Tị (6)",
        "status": "derived",
        "sourceRefs": [
          "src-11"
        ]
      },
      "ziWeiPositionRule1": {
        "value": null,
        "status": "unresolved_due_to_missing_source_data"
      },
      "ziWeiPositionRule2": {
        "value": 3,
        "branch": "Dần (3)",
        "status": "conflict-candidate",
        "sourceRefs": [
          "src-11"
        ]
      },
      "cuc": {
        "value": null,
        "status": "unresolved_due_to_missing_source_data"
      }
    }
  },
  {
    "id": "research-005",
    "profile": "unattributed-secondary",
    "input": {
      "yearCanChi": "mau-thin",
      "lunarMonth": 5,
      "lunarMonthBranch": "ngo",
      "lunarDay": 19,
      "birthHourBranch": "dau",
      "gender": "male",
      "elementPhase": 4
    },
    "observations": {
      "taiSuiGeneral": {
        "value": "Triệu Đạt Đại Tướng Quân",
        "status": "observed",
        "sourceRefs": [
          "src-01"
        ]
      },
      "mingGongPosition": {
        "value": 10,
        "branch": "Dậu (10)",
        "status": "derived",
        "sourceRefs": [
          "src-11"
        ]
      },
      "shenGongPosition": {
        "value": 7,
        "branch": "Ngọ (7)",
        "status": "derived",
        "sourceRefs": [
          "src-11"
        ]
      },
      "ziWeiPositionRule1": {
        "value": null,
        "status": "unresolved_due_to_missing_source_data"
      },
      "ziWeiPositionRule2": {
        "value": 4,
        "branch": "Mão (4)",
        "status": "conflict-candidate",
        "sourceRefs": [
          "src-11"
        ]
      },
      "cuc": {
        "value": null,
        "status": "unresolved_due_to_missing_source_data"
      }
    }
  },
  {
    "id": "research-006",
    "profile": "unattributed-secondary",
    "input": {
      "yearCanChi": "ky-ty",
      "lunarMonth": 6,
      "lunarMonthBranch": "mui",
      "lunarDay": 25,
      "birthHourBranch": "hoi",
      "gender": "female",
      "elementPhase": 2
    },
    "observations": {
      "taiSuiGeneral": {
        "value": "Quách Xán Đại Tướng Quân",
        "status": "observed",
        "sourceRefs": [
          "src-01"
        ]
      },
      "mingGongPosition": {
        "value": 9,
        "branch": "Thân (9)",
        "status": "derived",
        "sourceRefs": [
          "src-11"
        ]
      },
      "shenGongPosition": {
        "value": 8,
        "branch": "Mùi (8)",
        "status": "derived",
        "sourceRefs": [
          "src-11"
        ]
      },
      "ziWeiPositionRule1": {
        "value": null,
        "status": "unresolved_due_to_missing_source_data"
      },
      "ziWeiPositionRule2": {
        "value": 12,
        "branch": "Hợi (12)",
        "status": "conflict-candidate",
        "sourceRefs": [
          "src-11"
        ]
      },
      "cuc": {
        "value": null,
        "status": "unresolved_due_to_missing_source_data"
      }
    }
  },
  {
    "id": "research-007",
    "profile": "unattributed-secondary",
    "input": {
      "yearCanChi": "canh-ngo",
      "lunarMonth": 7,
      "lunarMonthBranch": "than",
      "lunarDay": 8,
      "birthHourBranch": "ty",
      "gender": "male",
      "elementPhase": 6
    },
    "observations": {
      "taiSuiGeneral": {
        "value": "Vương Thanh Đại Tướng Quân",
        "status": "observed",
        "sourceRefs": [
          "src-01"
        ]
      },
      "mingGongPosition": {
        "value": 9,
        "branch": "Thân (9)",
        "status": "derived",
        "sourceRefs": [
          "src-11"
        ]
      },
      "shenGongPosition": {
        "value": 9,
        "branch": "Thân (9)",
        "status": "derived",
        "sourceRefs": [
          "src-11"
        ]
      },
      "ziWeiPositionRule1": {
        "value": null,
        "status": "unresolved_due_to_missing_source_data"
      },
      "ziWeiPositionRule2": {
        "value": 6,
        "branch": "Tị (6)",
        "status": "conflict-candidate",
        "sourceRefs": [
          "src-11"
        ]
      },
      "cuc": {
        "value": null,
        "status": "unresolved_due_to_missing_source_data"
      }
    }
  },
  {
    "id": "research-008",
    "profile": "unattributed-secondary",
    "input": {
      "yearCanChi": "tan-mui",
      "lunarMonth": 8,
      "lunarMonthBranch": "dau",
      "lunarDay": 14,
      "birthHourBranch": "dan",
      "gender": "female",
      "elementPhase": 3
    },
    "observations": {
      "taiSuiGeneral": {
        "value": "Lý Tố Đại Tướng Quân",
        "status": "observed",
        "sourceRefs": [
          "src-01"
        ]
      },
      "mingGongPosition": {
        "value": 8,
        "branch": "Mùi (8)",
        "status": "derived",
        "sourceRefs": [
          "src-11"
        ]
      },
      "shenGongPosition": {
        "value": 10,
        "branch": "Dậu (10)",
        "status": "derived",
        "sourceRefs": [
          "src-11"
        ]
      },
      "ziWeiPositionRule1": {
        "value": null,
        "status": "unresolved_due_to_missing_source_data"
      },
      "ziWeiPositionRule2": {
        "value": 4,
        "branch": "Mão (4)",
        "status": "conflict-candidate",
        "sourceRefs": [
          "src-11"
        ]
      },
      "cuc": {
        "value": null,
        "status": "unresolved_due_to_missing_source_data"
      }
    }
  },
  {
    "id": "research-009",
    "profile": "unattributed-secondary",
    "input": {
      "yearCanChi": "nham-than",
      "lunarMonth": 9,
      "lunarMonthBranch": "tuat",
      "lunarDay": 29,
      "birthHourBranch": "mao",